Record Number,Publication Info.,Call No.,Horizon checkouts,Old in-house uses,Checkout Date,Standard No.,Title,CNY
i10912368,"Berkeley, University of California Press, 1973.",331.0952 C689J,1,,  -  -    ,$9.50,Japanese blue collar; the changing tradition [by] Robert E. Cole.,
i10912630,"Springfield, Ill. : Thomas, c1981.",155.2844 S819T2,1,,  -  -    ,398044805,The thematic apperception test : an introductory manual for its clinical use with adults / by Morris I. Stein.,
i10912678,"New York : St. Martin's Press, 1982.",351.819 R651,9,,  -  -    ,0312655665 : $25.00,Public secrets : a study in the development of government secrecy / K.G. Robertson.,X
i10912745,"Chicago : University of Chicago Press, 1981.",342.730853 H151,10,,  -  -    ,226312135,Speech and law in a free society / Franklyn S. Haiman.,X
i10912885,"New York : Wiley, c1982.",515.353 L313,5,,  -  -    ,471098663,"Numerical solution of partial differential equations in science and engineering / Leon Lapidus, George F. Pinder.",X
i10912903,"Monterey, Calif. : Brooks/Cole Engineering Division, 1982.",536.7 L863,22,,  -  -    ,0818504919 : $29.95,"Thermodynamics / Dwight C. Look, Jr., Harry J. Sauer, Jr.",X
i10913270,"Stroudburg, PA : Hutchinson Ross Pub. Co., c1982.",307.76 P7123,5,,  -  -    ,879334290,"The Planner's use of information : techniques for collection, organization, and communication / edited by Hemalata C. Dandekar.",ONLY PRATT
i10913282,"Stroudburg, PA : Hutchinson Ross Pub. Co., c1982.",307.76 P7123,7,,  -  -    ,879334290,"The Planner's use of information : techniques for collection, organization, and communication / edited by Hemalata C. Dandekar.",ONLY PRATT
i1091335x,"New York : Wiley, c1982.",541.392 S664,1,,  -  -    ,0471093475 : $42.95 (est.),"Chemical reaction equilibrium analysis : theory and algorithms / William R. Smith, Ronald W. Missen.",X
i10913440,"New York : McGraw-Hill, c1983.",624.183 C593,6,,  -  -    ,0070111634 : $29.95,Structural concrete cost estimating / John E. Clark.,X
i10913452,"San Francisco : Harper & Row, c1982.",261.8 W131,1,,  -  -    ,0060692405 (pbk.) : $4.95,Waging peace : a handbook for the struggle to abolish nuclear weapons / edited by Jim Wallis.,X
i10913488,"London ; New York : Academic Press, 1982.",371.3944 I61,2,,  -  -    ,126486808,Intelligent tutoring systems / edited by D. Sleeman and J.S. Brown.,
i1091349x,"New York : Wiley, 1983.",543 A532,1,,  -  -    ,0471043249 : $30.00 (est.),"Analytical aspects of environmental chemistry / [edited by] David F.S. Natusch, Philip K. Hopke.",X
i10913610,"Reading, Mass. : Addison-Wesley, c1983.",515.15 T831,52,1,  -  -    ,0201162709 : $30.95,Calculus and analytic geometry / Donald W. Trim.,X
i10913622,"New York : Academic Press, c1983.",664 T846,5,1,  -  -    ,127006605,Sanitation in food processing / John A. Troller.,X
i10913646,"Reading, Mass. : Addison-Wesley Pub. Co., c1983.",515.35 S211,35,,  -  -    ,0201077604 : $22.95,"Differential equations : an introduction / David A. Sanchez, Richard C. Allen, Jr., Walter T. Kyner.",ONLY PRATT
i10913683,"New York : Wiley, c1983.",511 M532,3,,  -  -    ,047186854X : $29.95 (est.),Bypasses : a simple approach to complexity / Z.A. Melzak.,X
i10913695,"New York : Wiley, c1983.",541.37 V339,1,,  -  -    ,047109028X : $35.00 (est.),"Electroanalytical chemistry / Basil H. Vassos, Galen W. Ewing.",X
i10913798,"New York : McGraw-Hill, c1984.",624 P238,11,2,  -  -    ,0070484899 : $34.95,"Planning and estimating heavy construction / Albert D. Parker, Donald S. Barrie, Robert M. Snyder.",ONLY PRATT
i10913804,"New York : Van Nostrand Reinhold, c1983.",604.25 O49I,7,,  -  -    ,0442270674 : $19.50,"Introduction to blueprint reading and sketching / C. Thomas Olivo, Albert V. Payne, Thomas P. Olivo.",X
i10913816,"New York : Van Nostrand Reinhold, c1983.",604.25 O49I,4,1,  -  -    ,0442270674 : $19.50,"Introduction to blueprint reading and sketching / C. Thomas Olivo, Albert V. Payne, Thomas P. Olivo.",X
i10913877,"Berlin ; New York : Springer-Verlag, 1983.",519.72 R321,2,,  -  -    ,0387115528 (U.S. : pbk.),Redundancy in mathematical programming : a state-of-the-art survey / [edited by] Mark H. Karwan ... [et al.] ; with contributions by Arnon Boneh ... [et al.].,X
i10913968,"London : E. Arnold, 1982.",519.50285 C772,2,,  -  -    ,713134410,"Basic statistical computing / D. Cooke, A.H. Craven, G.M. Clarke.",X
i10913993,"Chichester [West Sussex] ; New York : Wiley, c1983.",651.8 C518,8,,  -  -    ,0471901342 : $48.00,"Local area networks : issues, products, and developments / V.E. Cheong and R.A. Hirschheim.",X
i10914018,"New York : New York University Press, 1983.",327.174 A7345,1,,  -  -    ,0814750052 : $32.50,"Arms control, the multilateral alternative / edited by Edward C. Luck.",X
i10914043,"New York : Springer-Verlag, c1983.",668.411 S927,9,,  -  -    ,038790753X,"Additives for plastics / J. Stepek, H. Daoust.",ONLY PRATT
i10914079,"Chichester ; New York : Wiley, c1983.",658.4033 G822,0,,  -  -    ,0471901318 : $28.80,Mathematical methods in management / Geoffrey Gregory.,X
i10914183,"Chichester, West Sussex : E. Horwood ; New York : Halsted Press, 1983.",515.354 H954,4,,  -  -    ,0853124418 : L.16.50,Linear and nonlinear differential equations / I.D. Huntley and R.M. Johnson.,X
i10914237,"New York : Wiley, c1983.",515.35 B749,0,,  -  -    ,0471875465 : $25.00,"Fundamental concepts in the numerical solution of differential equations / J.F. Botha, G.F. Pinder.",X
i10914249,"New York : Wiley, c1983.",519 C597,1,,  -  -    ,047187504X : $34.95 (est.),Optimization and nonsmooth analysis / Frank H. Clarke.,X
i10914304,"Chichester [West Sussex] ; New York : Wiley, c1983.",624.1762 B732,8,,  -  -    ,0471262617 : $33.60,Earthquake engineering : damage assessment and structural design / S.F. Borg.,ONLY PRATT
i10914390,"New York : Van Nostrand Reinhold, c1983.",333.79 M963,6,,  -  -    ,442258380,"Energy economics, demand management, and conservation policy / Mohan Munasinghe, Gunter Schramm ; foreword by Marcel Boiteux.",X
i10914432,"New York : Plenum Press, c1983.",620.192 C934,6,,  -  -    ,306410583,"Heat-resistant polymers : technologically useful materials / J.P. Critchley, G.J. Knight, and W.W. Wright.",X
i10914444,"New York : M. Dekker, c1983.",664 C738,21,,  -  -    ,824713834,Computer-aided techniques in food technology / edited by Israel Saguy.,ONLY PRATT
i10914535,"Indianapolis : Bobbs-Merrill, [c1983]",362.71 C683,10,,  -  -    ,0672527774 : $16.95,"Your children should know : teach your children the strategies that will keep them safe from assault and crime / Flora Colao, Tamar Hosansky.",ONLY PRATT
i10914547,"New York : McGraw-Hill, c1984.",681.2 B782,41,,  -  -    ,0070067120 : $27.50,Digital instrumentation / A.J. Bouwens.,X
i10914602,"New York : Wiley, c1984.",658.478 H638,5,,  -  -    ,0471892165 (pbk.) : $14.95,Protecting your microcomputer system / Harold Joseph Highland.,ONLY PRATT
i10914845,"Englewood Cliffs, N.J. : Prentice-Hall, c1984.",420.72 S592,0,,  -  -    ,0131646400 : $32.95,Computations from the English : a procedural logic approach for representing and understanding English texts / Robert F. Simmons ; including HCPRVR and its documentation by Daniel L. Chester.,X
i10914857,"New York : Wiley, c1983.",664.02 B336,1,,  -  -    ,0471056944 : $28.95 (est.),"Food engineering fundamentals / J. Clair Batty, Steven L. Folkman.",ONLY PRATT
i10914948,"New York : McGraw-Hill, c1984.",658.84 D598,20,,  -  -    ,70460175,"The Direct marketing handbook / Edward L. Nash, editor in chief.",
i10915023,"Chicago : American Library Association, 1978.",301.451 N384,4,,  -  -    ,838902545,"Negotiating the mainstream : a survey of the Afro-American experience / Harry A. Johnson, editor.",X
i10915084,"New York : Wiley, c1983.",519.56 A288,71,,  -  -    ,0471097748 : $34.98 (est.),Linear statistical analysis of discrete data / Mikel Aickin.,X
i10915126,"Chichester, West Sussex : E. Horwood ; New York : Halsted Press, 1983.",519.2 B379,4,,  -  -    ,0853123926 : L.19.50;0470274816 (U.S. : lib. bdg.);0470274735 (U.S. : student ed.),Introductory applied probability / G.P. Beaumont.,X
i1091514x,"New York : R.R. Bowker, 1983.",686.209 C378P2,4,1,  -  -    ,835216950,The private press / Roderick Cave.,
i10915199,"London ; New York : Applied Science ; New York, N.Y. : Sole distributor in the USA and Canada, Elsevier Science Pub. Co., c1983.",613.28 D565,4,,  -  -    ,0853341788 : L.36.00,Dietary fibre / edited by G.G. Birch and K.J. Parker.,ONLY PRATT
i10915278,"Berlin ; New York : Springer-Verlag, 1983.",621.042 S755,1,,  -  -    ,0387124411 (U.S.),Principles of energetics / K.S. Spiegler.,X
i1091528x,"Westport, Conn. : AVI Pub. Co., c1983.",642.5 T511,4,,  -  -    ,087055431X : $25.00 (est.),"Quality control in foodservice / Marvin Edward Thorner, Peter Burnam Manning.",ONLY PRATT
i10915370,"Washington, D.C. : National Academy Press, 1983.",617.7 V652,11,,  -  -    ,0309033888 (pbk.),"Video displays, work, and vision / Panel on Impact of Video Viewing on Vision of Workers.",
i10915643,"Chichester ; New York : Wiley, c1984.",624.17 N532,1,1,  -  -    ,471902918,New directions in optimum structural design / edited by E. Atrek ... [et al.].,X
i10915722,"Chichester [West Sussex] ; New York : Wiley, c1984.",621.38043 B436,16,,  -  -    ,471903183,Digital processing of signals : theory and practice / Maurice Bellanger ; foreword by Pierre Agrain ; translated by Jean McMullan.,
i10915837,"New York : Wiley, c1984.",543 K45,5,,  -  -    ,470274905,Concepts in analytical chemistry / S.M. Khopkar.,X
i1091593x,"Boston, Mass. : Beacon Press, c1984.",305.42 B565,6,,  -  -    ,0807067121 : $29.95;080706713X (pbk.) : $9.95,"Between women : biographers, novelists, critics, teachers, and artists write about their work on women / edited by Carol Ascher, Louise DeSalvo, Sara Ruddick.",X
i10916088,"London, England ; Totowa, N.J. : F. Cass, 1983.",342.085 F8535,1,,  -  -    ,071463221X : $25.00 (U.S.),Freedom of information trends in the information age / edited by Tom Riley and Harold C. Relyea.,X
i10916118,"Englewood Cliffs, N.J. : Prentice-Hall, c1984.",696.1 H814,13,,  -  -    ,0136839126 (pbk.) : $19.95,Plumber's and pipefitter's handbook / William J. Hornung.,X
i10916349,"Chichester [West Sussex] ; New York : Wiley, c1984.",519.5 G467,4,1,  -  -    ,0471903809 (U.S.) : $44.40;0471903914 (U.S. : pbk.) : $20.40,Statistical modelling / Warren Gilchrist.,X
i10916350,"Chichester [Sussex] ; New York : Wiley, c1985.",671.3 N971,1,1,  -  -    ,0471903892 : $84.00,Numerical analysis of forming processes / edited by J.F.T. Pittman ... [et al.].,
i10916465,"New York : Wiley, c1984.",519.535 S443,0,,  -  -    ,047188104X : $49.00 (est.),Multivariate observations / G.A.F. Seber.,X
i10916477,"New York : St. Martin's Press, 1984.",327.11 A462,29,1,  -  -    ,0312047185 : $25.00 (est.),Arab petropolitics / Abdulaziz Al-Sowayegh.,X
i10916611,"New York : Wiley, c1984.",621.4021 S351,5,,  -  -    ,0471875996 : $29.95 (est.),"Introduction to thermal sciences : thermodynamics, fluid dynamics, heat transfer / Frank W. Schmidt, Robert E. Henderson, Carl H. Wolgemuth.",X
i10916684,"Chichester [West Sussex] ; New York : Wiley, c1985.",515.14 M426,5,,  -  -    ,0471103314 (U.S.) : $36.00,Mathematical methods in engineering / edited by Glyn A.O. Davies.,X
i10916878,"New York : F. Watts, c1984.",306.0973 P463,25,,  -  -    ,0531098265 : $19.95;053105649X (pbk.),Intellectual life in America : a history / Lewis Perry.,X
i10916908,"Monterey, CA : Brooks/Cole Engineering Division, c1984.",620.11 A834,23,,  -  -    ,0534029574;0534029582 : $25.00 (est.),The science and engineering of materials / by Donald R. Askeland.,X
i10917032,"San Luis Obispo, Calif. : Impact Publishers, c1984.",307.14 B513,8,,  -  -    ,0915166291 (pbk.) : $8.95,Community dreams : ideas for enriching neighborhood and community life / Bill Berkowitz.,X
i10917068,"New York : Wiley, c1984.",536.5 B463F3,9,1,  -  -    ,471893838,"Fundamentals of temperature, pressure, and flow measurements / Robert P. Benedict.",
i1091707x,"Englewood Cliffs, N.J. : Prentice-Hall, c1984.",670.285 S989,9,,  -  -    ,130328715,An analysis of CAD/CAM applications : with an introduction to CIM / Richard N. Stover.,X
i10917111,"New York : Sterling Pub. Co., c1984.",690.837 R888,7,2,  -  -    ,0806977647 (pbk). : $7.95,Earthwood : building low-cost alternative houses / Robert L. Roy.,ONLY PRATT
i10917342,"New York : Harmony Books, c1984.",362.1 W846,3,,  -  -    ,0517553511 : $14.95,The medical industrial complex / Stanley Wohl.,X
i10917949,"Chicago : American Library Association, 1984.",323.445 D751F1,4,,  -  -    ,0838904122 (alk. paper) : $25.00,The First freedom today : critical issues relating to censorship and intellectual freedom / edited by Robert B. Downs and Ralph E. McCoy.,X
i10918115,"New York : M. Dekker, c1984.",620.0042 K74,7,,  -  -    ,824770897,Engineering documentation for CAD/CAM applications / Charles S. Knox.,X
i10918358,"Glenview, Ill. : Scott, Foresman, c1985.",658.022 G127,15,,  -  -    ,673165981,"Small business management / Ralph M. Gaedeke, Dennis H. Tootelian.",
i10918383,"New York : Plenum Press, c1984.",530.70285 M242,1,,  -  -    ,306416689,Microcomputers and laboratory instrumentation / David J. Malcolme-Lawes.,
i10918577,"New York : Wiley, c1984.",515.353 P911,4,,  -  -    ,470200715,"Partial differential equations / Phoolan Prasad, Renuka Ravindran.",
i10918826,"New York, N.Y. : Van Nostrand Reinhold Co., c1984.",658.054 G551,2,,  -  -    ,442227795,Business power for your Apple / Gregory R. Glau.,ONLY PRATT
i10918863,"New York : Plenum Press, c1984.",541.37 E96,2,,  -  -    ,306414481,Experimental methods in electrochemistry / edited by Ralph E. White ... [et al.].,X
i10919296,"New York : Springer-Verlag, c1984.",519 F767,1,,  -  -    ,038790977X,Combinatorial optimization for undergraduates / L.R. Foulds.,X
i10919533,"Dubuque, Iowa : W.C. Brown Co. Publishers, c1984.",510 N975,1,1,  -  -    ,697085511,"Essentials of technical mathematics / Harry L. Nustad, Terry H. Wesner.",
i10919727,"New York : Simon & Schuster, 1984, c1967.",230 T577M1,5,,  -  -    ,0671505858 (pbk.),My search for absolutes / by Paul Tillich ; with drawings by Saul Steinberg.,X
i10919764,"New York : Wiley, c1984.",670.285 P211,14,,  -  -    ,471881945,"Elements of computer-aided design and manufacturing, CAD/CAM / Y.C. Pao.",X
i1091979x,"New York : Wiley, c1984.",519.535 A551,2,,  -  -    ,471889873,An introduction to multivariate statistical analysis / T.W. Anderson.,
i10919806,"New York : Wiley, c1984.",519.2 B575,2,,  -  -    ,047187826X : $45.00 (est.),Elements of applied stochastic processes / U. Narayan Bhat.,X
i1091982x,"New York : Wiley, c1984.",621.381958 H645,33,,  -  -    ,0471085391 : $39.95 (est.),Digital logic and microprocessors / Fredrick J. Hill and Gerald R. Peterson.,X
i10919867,"Ithaca : Cornell University Press, 1984.",355.0217 J57,0,,  -  -    ,0801417155 (alk. paper),The illogic of American nuclear strategy / Robert Jervis.,X
i10919879,"Ithaca : Cornell University Press, 1984.",355.0217 J57,1,,  -  -    ,0801417155 (alk. paper),The illogic of American nuclear strategy / Robert Jervis.,X
i10919892,"Cambridge, Mass. : MIT Press, c1984.",324.73 D537,5,,  -  -    ,262040751,The spot : the rise of political advertising on television / Edwin Diamond and Stephen Bates.,
i10919909,"Cambridge, Mass. : MIT Press, c1984.",363.18 S825,2,1,  -  -    ,262192306,The microwave debate / Nicholas H. Steneck.,X
i10919983,"New York : Putnam's, c1984.",640 M152,6,,  -  -    ,039912974X,"Movin' on out : starting out on your own : a guide for finding that first apartment, polishing consumer smarts, managing your money, meeting new friends, and much more! / David J. McIntyre.",X
i10920213,"London ; Baltimore, Md. : E. Arnold, 1983.",363.70942 R883,5,,  -  -    ,713128550,"Environment and health / Anthony J. Rowland, Paul Cooper.",
i10920298,"Chichester, West Sussex : Published for the Society of Chemical Industry, London, by E. Horwood ; New York, N.Y. : Halsted Press [distributor], 1984.",660.28423 I64,14,,  -  -    ,0853127700 : L.45.00;0470200898 (U.S.),"Ion exchange technology / editors, D. Naden and M. Streat.",ONLY PRATT
i10920365,"New York : Wiley, c1984.",001.642 C777,20,,  -  -    ,471810363,The laboratory microcomputer : programming in Pascal and MC68000 assembly language on the IBM system 9000 / James W. Cooper.,X
i10920614,"[New York, NY] : Viking, 1985.",381.13 L977,4,1,  -  -    ,0670326585 : $17.95,Roadside empires : how the chains franchised America / Stan Luxenberg.,X
i10920675,"Reading, Mass. : Addison-Wesley, 1984.",371.3358 T968,7,,  -  -    ,0201064200 : $16.95 (est.),"TV, science, and kids : teaching our children to question / [edited by] Kim Hays (Action for Children's Television) ; foreword by Lewis Thomas.",X
i10920705,"New York : Pergamon Press, 1984.",660.63 C734,3,1,  -  -    ,0080316204 : $60.00 (est.),"Commercial biotechnology : an international analysis / Office of Technology Assessment, Congress of the United States.",ONLY PRATT
i10920717,"New York : W. Morrow, c1985.",306.0973 K47,3,,  -  -    ,688004563,The road to colossus : a celebration of American ingenuity / Thomas Kiernan.,X
i10920729,"Boston : Houghton Mifflin, 1984.",271.1 M575M,3,,  -  -    ,0395313244 : $24.95,The seven mountains of Thomas Merton / Michael Mott.,X
i10920730,"[Tokyo] : University of Tokyo Press, c1983.",624.1762 K16,7,,  -  -    ,0860083268 : Y6000,Engineering seismology / Kiyoshi Kanai.,X
i1092081x,"London ; New York : Chapman and Hall, 1984.",519.535 E93,5,,  -  -    ,412253100,An introduction to latent variable models / B.S. Everitt.,X
i10921126,"Garden City, N.Y. : Anchor Press/Doubleday, 1984.",305.42 S623,6,,  -  -    ,0385177968 : $24.95;0385177976 (pbk.) : $12.95,"Sisterhood is global : the international women's movement anthology / compiled, edited, and with an introduction by Robin Morgan.",X
i10921138,"Garden City, N.Y. : Anchor Press/Doubleday, 1984.",305.42 S623,1,0,  -  -    ,0385177968 : $24.95;0385177976 (pbk.) : $12.95,"Sisterhood is global : the international women's movement anthology / compiled, edited, and with an introduction by Robin Morgan.",X
i1092159x,"New York : Basic Books, c1984.",222.12 W242,5,,  -  -    ,0465021646 : $17.95,Exodus and revolution / Michael Walzer.,
i10921771,"[Tokyo] : University of Tokyo Press, c1984.",624.1762 O41,15,,  -  -    ,4130681044 (UTP 69042);0860083616,Introduction to earthquake engineering / by Shunzo Okamoto.,X
i10922805,[New York] Avant-Garde Books [1973],365.6 G493,5,,  -  -    ,0913568007 $2.95,Castrated: my eight months in prison.,X
i10922878,"Beaverton, Or. : dilithium Press, c1984.",001.6424 E514,2,,  -  -    ,0880563036 (pbk.) : $19.95,The programmer's toolbox / Jack Emmerichs.,X
i1092288x,"Blue Ridge Summit, PA. : Tab Books, c1984.",001.642 S841,1,,  -  -    ,0830607242 : $19.95;0830617248 (pbk.) : $12.95,How to document your software / by Barbara Spear.,X
i10922957,"Englewood Cliffs, N.J. : Prentice-Hall, c1984.",001.64 B789,16,,  -  -    ,0139369562 (pbk.),Understanding microcomputer concepts : a guide for beginners and hobbyists / Jefferson C. Boyce.,ONLY PRATT
i10922970,"Berkeley, Calif. : Osborne/McGraw-Hill, c1983.",001.6424 E85,2,,  -  -    ,0881341029 (pbk.) : $17.95,"The MBASIC handbook / Walter A. Ettlin, Gregory Solberg.",ONLY PRATT
i10923159,"Garden City, N.Y. : Doubleday, 1984.",419 S321,33,1,  -  -    ,038517344X : $9.95,Speaking the language of sign : the art and science of signing / Jerome D. Schein ; illustrations by Mona Mark.,X
i10923408,"Passaic, NJ : Creative Homeowner Press, c1980.",643.7 N972,3,1,  -  -    ,0932944183 (pbk.) : $7.95;0932944175,"Home improvement, home repair / Richard V. Nunn.",ONLY PRATT
i10923470,"New York, N.Y. : Petrocelli Books, c1985.",364.168 V246,10,,  -  -    ,894332562,The human factor in computer crime / J. Van Duyn.,X
i10923500,"Dhahran, Saudi Arabia : Aramco, 1980.",338.27 A658,4,,  -  -    ,960116427,"Aramco and its world : Arabia and the Middle East / ed. by Ismail I. Nawwab, Peter C. Speers, Paul F. Hoye ; main research and writing, Paul Lunde and John A. Sabini ; caption research and writing, Lyn Maby.",X
i1092386x,"Boston : Houghton Mifflin, 1984.",070.573 D262,2,,  -  -    ,0395343984 : $19.95;0395355354 (pbk.) : $9.95,Two-bit culture : the paperbacking of America / Kenneth C. Davis.,X
i10923901,"Englewood Cliffs, N.J. : Prentice-Hall, c1982.",643.7 C678,1,,  -  -    ,0136339581 (pbk.);0136339662,Old houses into new / Margie K. Cohen.,ONLY PRATT
i10924000,"Homewood, Ill. : Dow Jones-Irwin, c1984.",658.4038 M982,2,,  -  -    ,870944282,Managing information systems as a corporate resource / John P. Murray.,X
i10924127,"Chichester ; New York : Wiley, c1982.",516.362 A491,3,,  -  -    ,0471025761 : $10.00 (est.);0440025761,Combinatorial integral geometry : with applications to mathematical stereology / R.V. Ambartzumian ; edited with an appendix by Adrian Baddeley.,X
i10924139,"New York : Plenum Press, c1984.",670.427 O97,5,,  -  -    ,306415275,Flexible assembly systems : assembly by robots and computerized integrated systems / A.E. (Tony) Owen.,X
i10924516,"Garden City, N.Y., Doubleday, Doran & Company, inc., 1932.",332.092 C289H,3,,  -  -    ,,"The life of Andrew Carnegie, by Burton J. Hendrick ...",
i10924528,"Garden City, N.Y., Doubleday, Doran & Company, inc., 1932.",332.092 C289H,5,,  -  -    ,,"The life of Andrew Carnegie, by Burton J. Hendrick ...",
i1092453x,"Garden City, New York, Doubleday, Doran and company, inc., 1943.",509.2 C331H,4,,  -  -    ,,"George Washington Carver, an American biography by Rackham Holt.",
i10924541,"New York, Carnegie corporation of New York, 1935.",332.092 C289C,4,,  -  -    ,,"Andrew Carnegie centenary, 1835-1935; the memorial address by Sir James Colquhoun Irvine, and other tributes to the memory of Andrew Carnegie.",
i10924747,"New York : Harper & Row, 1970",371.10092 C743,0,,  -  -    ,,My several lives: memoirs of a social inventor / by James B. Conant.,
i1092503x,"New York, Random House [1952]",364.13 C445W,0,,  -  -    ,,Witness.,
i10925259,"New York : St. Martin's Press, c1984.",320.943 P769,2,,  -  -    ,312626223,Politics and government in the Federal Republic of Germany : basic documents / edited by Carl-Christoph Schweitzer ... [et al.],
i10925375,"Englewood Cliffs, N.J. : Prentice-Hall, c1984.",668.419 S785,1,,  -  -    ,138423105,Standards and guidelines for electroplated plastics / American Society of Electroplated Plastics.,ONLY PRATT
i10925399,"New York : Wiley, c1984.",536.25 B424,7,,  -  -    ,0471896128 : $39.95 (est.),Convection heat transfer / Adrian Bejan.,X
i10925430,"New York : McGraw-Hill, c1984.",621.380422 F948,14,,  -  -    ,007022594X : $38.00,Manual of satellite communications / Emanuel Fthenakis.,X
i10925454,"Cambridge, Mass. : MIT Press, c1984.",150.1 F583,2,,  -  -    ,0262060906;0262560313 (pbk.),"The science of the mind / Owen J. Flanagan, Jr.",X
i1092551x,"Phoenix, AZ : Oryx Press, 1983.",575.007 E93,19,,  -  -    ,897740610,Evolution versus Creationism : the public education controversy / edited by J. Peter Zetterberg.,X
i10925521,"New York : McGraw-Hill, c1984.",621.381952 H198,13,,  -  -    ,0070256837 : $34.95,"Computer organization / V. Carl Hamacher, Zvonko G. Vranesic, Safwat G. Zaky.",X
i10925545,"New York : Norton, c1984.",196 O77H,4,,  -  -    ,0393018318 : $19.95,Historical reason / Ortega y Gasset.,X
i10925648,"San Francisco : Jossey-Bass, 1984.",378.12 L918,1,,  -  -    ,0875895980 (alk. paper),Mastering the techniques of teaching / Joseph Lowman.,X
i10925727,"[Washington, D.C.] : U.S. G.P.O., 1984.",636.089 A598,21,,  -  -    ,,Animal health : livestock and pets.,
i10925818,"New York : Simon and Schuster, c1982",363.7 F699,11,,  -  -    ,671253018,The cult of the atom : the secret papers of the Atomic Energy Commission / Daniel Ford.,X
i10925843,"New York : Pantheon Books, c1983.",363.7 H575,2,,  -  -    ,0394530403 : $16.95,Nuclear inc. : the men and money behind nuclear energy / Mark Hertsgaard.,X
i10926033,"Columbus : C.E. Merrill Pub. Co., c1984.",001.6424 M854,6,,  -  -    ,0675201063 (pbk.),Structured BASIC programming / Harry A. Moriber.,X
i10926197,"New York : Macmillan, c1984.",364.132 N817,3,,  -  -    ,0029228808 : $29.95,"Bribes / John T. Noonan, Jr.",X
i10926355,"New York : McGraw-Hill, c1984.",604.2 F876G4,10,,  -  -    ,0070223076 : $29.95,"Graphic science and design / Thomas E. French, Charles J. Vierck, Robert J. Foster.",X
i10926367,"New York : McGraw-Hill, c1984.",604.2 F876G4,10,,  -  -    ,0070223076 : $29.95,"Graphic science and design / Thomas E. French, Charles J. Vierck, Robert J. Foster.",X
i10926781,"New York, Random House [1974]",347.7326 D737G,8,,  -  -    ,394488342,"Go East, young man: the early years; the autobiography of William O. Douglas.",
i10927074,"New York, Harcourt, Brace & World [1962]",509.2 D328S,0,,  -  -    ,,"The sweeping wind, a memoir.",
i10927402,"New York : Simon and Schuster, c1984.",152.4 G287,12,1,  -  -    ,671421301,The rage within : anger in modern life / Willard Gaylin.,
i10927414,"New York : McGraw-Hill, c1984.",384 C551,3,,  -  -    ,0070108501 : $32.95,"Interactive message services : planning, designing, and implementing Videotex / Dimitris N. Chorafas.",ONLY PRATT
i1092744x,"New York : Macmillan ; London : Collier Macmillan, c1984.",001.64404 S782,38,,  -  -    ,24154601,Local networks : an introduction / William Stallings.,X
i10928522,"New York : Wiley, c1984.",547.84 B598T3,9,,  -  -    ,0471031968 : $32.50 (est.),"Textbook of polymer science / Fred W. Billmeyer, Jr.",X
i10928637,"New York : Wiley, c1984.",621.3 S657C4,13,,  -  -    ,471874965,"Circuits, devices, and systems : a first course in electrical engineering / Ralph J. Smith.",
