Record Number,Publication Info.,Call No.,Horizon checkouts,Old in-house uses,Checkout Date,Standard No.,Title,CNY
i10860216,"Englewood Cliffs, N.J. : Prentice-Hall, c1978.",380.509 H293,8,1,  -  -    ,013930214X : $16.95,"Transportation in America : users, carriers, government / Donald V. Harper.",X
i10860289,"New York : Oxford University Press, 1978.",155.8 L438,1,,  -  -    ,0195023420 : $10.95. 0195023439 pbk. : $3.50,Learning non-aggression : the experience of non-literate societies / edited by Ashley Montagu.,X
i10860794,"London, Faber and Faber [1948]",634.5 H859N,8,,  -  -    ,,Nuts: their production and everyday uses.,ONLY PRATT
i10860812,"New York, Scribner [1970]",635.976 S438,13,,  -  -    ,,Shrubs for your garden.,ONLY PRATT
i10861117,"London, C. Lockwood, 1953.",010 B799D2,0,2,  -  -    ,,Documentation. With an introd. by Jesse H. Shera and Margaret E. Egan.,
i10861403,"New York, Simon and Schuster [1974]",345.0231 S377,0,,  -  -    ,0671217879 $9.95,Test of loyalty: Daniel Ellsberg and the rituals of secret government.,X
i10861592,"Rome : Food and Agriculture Organization of the United Nations, 1976.",664.07 S386,1,,  -  -    ,9251000948,"Cadmium, lead, mercury, and methylmercury compounds : a review of methods of trace analysis and sampling with special reference to food / by Pieter L. Schuller and Harold Egan.",ONLY PRATT
i10861671,"New York : Viking Press, 1960.",301 H351,1,,  -  -    ,,Of societies and men / Caryl P. Haskins.,
i10861725,"New York : Johnson Reprint Corporation, 1965.",327.73 M169,0,,  -  -    ,,"America, Britain, & Russia : their co-operation and conflict, 1941-1946 / by William Hardy McNeill.",
i1086183x,"New York : P. A. Struck, 1946-1950.",686.225 R367M,5,1,  -  -    ,,Modern and historical typography : an illustrated guide.,
i10862250,"New York : Praeger, 1977.",330.9 P966,3,,  -  -    ,0030414466 : $16.95. 0030414415 pbk. : $5.95,Prospects for growth : changing expectations for the future / edited by Kenneth D. Wilson.,X
i10862389,"New York : Wiley, c1979.",624.151 L221S,7,,  -  -    ,471024910,"Soil mechanics, SI version / T. William Lambe, Robert V. Whitman ; with the assistance of H. G. Poulos.",X
i10863187,"New York, Columbia University Press [1955, c1955-56]",301 C726M,0,,  -  -    ,,"Man in contemporary society; a source book prepared by the Contemporary civilization staff of Columbia College, Columbia University.",
i10863230,"Grand Rapids : Baker Book House, 1963.",225.92 R181,1,,  -  -    ,,The cities of St. Paul : their influence on his life and thought. The cities of eastern Asia Minor / by W. M. Ramsay.,
i10863527,"New York : Grosset & Dunlap, [1972, c1954]",128 K94,1,,  -  -    ,448000067,"The measure of man : on freedom, human values, survival, and the modern temper / Joseph Wood Krutch.",
i10863539,"New York : Grosset & Dunlap, [1972, c1954]",128 K94,3,,  -  -    ,448000067,"The measure of man : on freedom, human values, survival, and the modern temper / Joseph Wood Krutch.",
i10863667,"New York, G. P. Putnam's sons, 1881.",192 F78,1,,  -  -    ,,"Bacon, by Thomas Fowler.",
i10863801,"New York : Simon and Schuster, c1977.",322.4 C375,0,,  -  -    ,671226827,The great fear : the anti-Communist purge under Truman and Eisenhower / David Caute.,X
i10864003,"Cambridge, Mass. : MIT Press, c1978.",301.444 S377,1,,  -  -    ,262191695,Ten thousand working days / by Robert Schrank.,X
i10864064,"Madras, Ganesh [1965]",294.55 W893,2,,  -  -    ,,Sakti and sakta; essays and addresses [by] Sir John Woodroffe.,
i10864118,"Ithaca, N.Y., Center for International Studies, Cornell University, 1964.",301.0947 F529,0,,  -  -    ,,Science and politics; the new sociology in the Soviet Union.,
i10864659,"Boston : Houghton-Mifflin, 1978, c1977.",574 H678,5,,  -  -    ,395258111,"The roots of life : a layman's guide to genes, evolution, and the ways of cells / Mahlon B. Hoagland.",
i10864660,"New York : Oxford University Press, 1978.",331.4 K19,0,,  -  -    ,0195023684 : $12.95,Seven days a week : women and domestic service in industrializing America / David M. Katzman.,
i10864805,"Westport, Conn. : AVI Pub. Co., c1978.",641.57 M341Q,2,,  -  -    ,870552368,Quantity cooking / Thomas Mario.,ONLY PRATT
i10864866,"New York : Holt, Rinehart and Winston, c1978.",362.782 G812,1,,  -  -    ,003089896X,A place for Noah / Josh Greenfeld.,X
i10864994,"New York, Chelsea Pub. Co. [c1956]",516.57 H194E,0,,  -  -    ,,Lectures on ergodic theory.,
i10865445,"Cambridge [Eng.] The University press, 1920.",289.6 G73,35,,  -  -    ,,"The faith of a Quaker, by John W. Graham.",
i10865822,"New York : Simon and Schuster, c1978.",616.043 W189,30,1,  -  -    ,671226274,The two : a biography / Irving Wallace and Amy Wallace.,
i10865846,"New York : Harper's College Press, c1977.",658.4007 D794,2,,  -  -    ,61664030,Management cases / Peter F. Drucker.,
i10865986,"London, H.M.S.O., 1965.",309.2942 G787,3,,  -  -    ,,The future of development plans; a report.,ONLY PRATT
i10866000,"London, H.M.S.O., 1965.",309.2942 G787,,,  -  -    ,,The future of development plans; a report.,ONLY PRATT
i10867673,"New York, Harcourt, Brace and company, 1937.",330.94 B261,3,,  -  -    ,,"An economic history of the western world, by Harry Elmer Barnes ...",
i1086782x,"Oak Ridge, Tenn. : Energy Research and Development Administration, Oak Ridge National Laboratory, Information Division, Information Center Complex, 1977.",665.7 E61,5,,  -  -    ,pbk.,"Environmental, health, and control aspects of coal conversion : an information overview / edited by H. M. Braunstein, Emily D. Copenhaver, and H. A. Pfuderer ; Information Center Complex, Information Division, Oak Ridge National Laboratory ; operated by Union Carbide Corporation.",
i10867831,"Oak Ridge, Tenn. : Energy Research and Development Administration, Oak Ridge National Laboratory, Information Division, Information Center Complex, 1977.",665.7 E61,0,,  -  -    ,pbk.,"Environmental, health, and control aspects of coal conversion : an information overview / edited by H. M. Braunstein, Emily D. Copenhaver, and H. A. Pfuderer ; Information Center Complex, Information Division, Oak Ridge National Laboratory ; operated by Union Carbide Corporation.",
i10867958,"Cambridge, Mass. : MIT Press, 1977.",301.36 C348,17,1,  -  -    ,262030632,The urban question : a Marxist approach / Manuel Castells ; translated by Alan Sheridan.,
i10868082,"London, Macmillan and Co., limited, 1936.",341.1 Z77,0,,  -  -    ,,"The League of nations and the rule of law, 1918-1935, by Alfred Zimmern ...",
i10868124,"Berkley and Los Angeles : University of California Press, 1941.",380.124 M682B2,0,,  -  -    ,338.54,Business cycles and their causes / Wesley Clair Mitchell.,
i10868161,"Oxford [Eng.] : Oxford University Press, 1976.",668.6 P476,14,1,  -  -    ,0198545223 : L.5.00. 0198545266 pbk.,Pesticides and human welfare / edited by D. L. Gunn and J. G. R. Stevens.,X
i10868264,"New York : Plenum Press, c1977.",616.9 C456,0,1,  -  -    ,306310589,"Nutrition, immunity, and infection : mechanisms of interactions / R. K. Chandra, P. M. Newberne.",ONLY PRATT
i10868318,"Boston : Allyn and Bacon, c1978, 1979 printing.",620.3 T882,17,,  -  -    ,0205059406 : $21.95,"Mechanical vibrations : theory and applications / Francis S. Tse, Ivan E. Morse, Rolland T. Hinkle.",X
i10868409,"Washington : The Society, 1977.",543 V172,8,,  -  -    ,841203962,"Validation of the measurement process : a symposium / sponsored by the Division of Analytical Chemistry at the 171st meeting of the American Chemical Society, New York, N.Y., April 5-6, 1976 ; James R. DeVoe, editor.",X
i10868458,"Dubuque, Iowa : Kendall/Hunt Pub. Co., c1977.",604.24 R595,7,,  -  -    ,840315937,"Engineering graphics : communication, analysis, creative design / James S. Rising, Maurice W. Almfeldt, Paul S. DeJong.",
i10868525,"Den Haag, 1968]",655.2 M468,7,,  -  -    ,fl 15.00,Publikaties van de Edition Hansjorg Mayer en werk van Hansjorg Mayer. Publications by Edition Hansjorg Mayer and works by Hansjorg Mayer. Uitg. als onderdeel van een tentoonstelling in het Haags Gemeentemuseum [van] 5 oktober t/m 24 november 1968. [Met een inleiding van Hands Locher en Kees Broos.,ONLY PRATT
i10868677,"Chicago : The University of Chicago Press, 1960.",301.34 R315,0,,  -  -    ,,The little community : and Peasant society and culture / by Robert Redfield.,
i1086877x,"London, Macmillan and Co., limited; New York, The Macmillan Company, 1906-10.",426 S15,2,,  -  -    ,,"A history of English prosody from the twelfth century to the present day, by George Saintsbury ...",
i10868781,"London, Macmillan and Co., limited; New York, The Macmillan Company, 1906-10.",426 S15,2,,  -  -    ,,"A history of English prosody from the twelfth century to the present day, by George Saintsbury ...",
i10868793,"London, Macmillan and Co., limited; New York, The Macmillan Company, 1906-10.",426 S15,2,,  -  -    ,,"A history of English prosody from the twelfth century to the present day, by George Saintsbury ...",
i10869219,"Park Ridge, N.J. : Noyes Data Corp., 1977.",665.772 L218U,2,,  -  -    ,0815506708 : $36.00,Underground coal gasification / George H. Lamb.,X
i10869268,"New York : R. R. Bowker, 1977.",070.573 B468,0,1,  -  -    ,835210332,A candid critique of book publishing / by Curtis G. Benjamin.,X
i10869359,"New York : Simon and Schuster, c1978.",301.411 C524,4,1,  -  -    ,671229397,About men : a psycho-sexual meditation / by Phyllis Chesler.,
i10869402,"New York : Harper & Brothers Publishers, 1912.",070.50973 H295H,0,,  -  -    ,,The house of Harper : a century of publishing in Franklin Square / by J. Henry Harper ; with portraits.,
i1086961x,"Oxford, New York, Pergamon Press [1965, c1954]",664.3 A544,0,,  -  -    ,,"Margarine, by A.J.C. Andersen and P.N. Williams.",
i10869669,"Cambridge [Eng.] University Press, 1958.",540.9032 B792B,0,,  -  -    ,,Robert Boyle and seventeenth-century chemistry.,
i10869670,"[Washington, D.C.] : Maple Press Co., [1977]",350.079 B368,9,,  -  -    ,,"The Jefferson awards : National public service awards, a discussion of major issues facing america / Edited by Samuel S. Beard.",ONLY PRATT
i10870040,"New York; London, Harper & Brothers, 1947.",353.5 M133N,0,,  -  -    ,,"The nine young men, by Wesley McCune.",
i10870180,"Reading, Mass. : Addison-Wesley Pub. Co., c1977.",658.406 B396,14,1,  -  -    ,020100335X,"Organizational transitions : managing complex change / Richard Beckhard, Reuben T. Harris.",X
i10870325,"New York : Wiley, c1978.",541.369 B259,27,,  -  -    ,471032387,Handbook of thermochemical data for compounds and aqueous species / Herbert E. Barner and Ricard V. Scheuerman.,X
i10870416,"Austin : University of Texas Press, c1978.",335.83 H846,1,,  -  -    ,0292703317 : $14.95,"Anarchism & the Mexican working class, 1860-1931 / John M. Hart.",X
i10870751,"London : Macmillan, 1932.",290 S915B,14,,  -  -    ,,The Buddha and the Christ : an exploration of the meaning of the universe and of the purpose of human life/ by Burnett Hillman Streeter.,
i10870854,"London : S.P.C.K., 1961.",225 C121,9,,  -  -    ,,The making of Luke-Acts / By Henry J. Cadbury.,
i10871019,"Brooklyn, N. Y. : Assembling Press, 1970-",686 A844,0,,  -  -    ,,Assembling: a collection of otherwise unpublishable manuscripts / compiled by Richard Kostelanetz and Henry Korn.,ONLY PRATT
i10871020,"Brooklyn, N. Y. : Assembling Press, 1970-",686 A844,0,,  -  -    ,,Assembling: a collection of otherwise unpublishable manuscripts / compiled by Richard Kostelanetz and Henry Korn.,ONLY PRATT
i10871044,"Brooklyn, N. Y. : Assembling Press, 1970-",686 A844,,,  -  -    ,,Assembling: a collection of otherwise unpublishable manuscripts / compiled by Richard Kostelanetz and Henry Korn.,ONLY PRATT
i10871056,"Brooklyn, N. Y. : Assembling Press, 1970-",686 A844,,,  -  -    ,,Assembling: a collection of otherwise unpublishable manuscripts / compiled by Richard Kostelanetz and Henry Korn.,ONLY PRATT
i10871214,"New York : Wiley, c1968-1971.",519 F318I3,9,,  -  -    ,0471257087 0471257095,An introduction to probability theory and its applications / William Feller.,
i10871305,"New York : London House & Maxwell, 1969.",655.142 B636,3,,  -  -    ,,Caxton and his world / N. F. Blake.,
i10871548,"New York, Published for the Welfare Council of New York City by Columbia University Press, 1935.",331.85 K35,4,,  -  -    ,,"Social settlements in New York City; their activities, policies, and administration, by Albert J. Kennedy, Kathryn Farra and associates.",
i10871652,"Detroit : Gale Research Co., [1977]",016.707 B942,2,,  -  -    ,810312727,Art education : a guide to information sources / Clarence Bunch.,X
i10871664,"Detroit : Gale Research Co., [1977]",016.707 B942,5,,  -  -    ,810312727,Art education : a guide to information sources / Clarence Bunch.,X
i10871688,"New York : Academic Press, 1978.",671.37 P881,3,,  -  -    ,124284507,"Powder metallurgy processing : new techniques and analyses / edited by Howard A. Kuhn, Alan Lawley ; contributors, George E. Dieter ... [et al.].",X
i10871706,"New York : Times Books, c1977.",301.417 P626,6,,  -  -    ,812907264,Beyond the male myth : what women want to know about men's sexuality : a nationwide survey / Anthony Pietropinto and Jacqueline Simenauer.,
i10871731,"Cambridge, Mass. : Harvard University Press, 1978, 1979 printing.",170 F899,1,,  -  -    ,674769058,Right and wrong / Charles Fried.,
i10871779,"New York : McGraw-Hill, c1978.",332.024 R564,3,,  -  -    ,0070528101 : $8.95,"How to beat the salary trap : 8 steps to financial independence / Richard King Rifenbark, with David Johnson.",ONLY PRATT
i10872176,"Jerusalem : Israel Universities Press, c1972.",327.56 H282,3,,  -  -    ,706511646,Arab attitudes to Israel / Y. Harkabi ; translated [from the Hebrew] by Misha Louvish.,
i10872693,"New York : M. Dekker, c1978.",660.29 N669,3,,  -  -    ,824766903,Predicting the properties of mixtures : mixture rules in science and engineering / Lawrence E. Nielsen.,ONLY PRATT
i10872735,"Berlin ; New York : Springer-Verlag, 1978.",515.42 S454,10,,  -  -    ,387083235,"Integrals and operators / Irving E. Segal, Ray A. Kunze.",
i10873144,"Chicago : University of Chicago Press 1965, c1960.",415 H694,4,1,  -  -    ,,Language change and linguistic reconstruction / Henry M. Hoenigswald.,
i10873168,"London, G. Howe, Ltd., 1932.",070.52 S978A,0,,  -  -    ,,"Authors and the book trade, by Frank Swinnerton.",
i10873193,"New York, Random House [1945]",385 M368,2,,  -  -    ,,"Santa Fe, the railroad that built an empire.",X
i10873594,"Englewood Cliffs, N.J. : Prentice-Hall, c1978.",301.36 M877,3,,  -  -    ,130892270,Bum rap on America's cities : the real causes of urban decay / Richard S. Morris.,
i10873600,"New York : Norton, c1978.",301.36 M468,3,,  -  -    ,393087964,"The builders : houses, people, neighborhoods, governments, money / Martin Mayer.",X
i10873727,"Washington : Smithsonian Institution ; New York : Distributed to the trade by Norton, 1977.",069 S664,2,,  -  -    ,$19.95,"The Smithsonian experience : science, history, the arts ... the treasures of the nation.",
i10873739,"Washington : Smithsonian Institution ; New York : Distributed to the trade by Norton, 1977.",069 S664,2,,  -  -    ,$19.95,"The Smithsonian experience : science, history, the arts ... the treasures of the nation.",
i10873892,"New York, Published for the School for Graduate Studies, Concordia Seminary, St. Louis [by] Bookman Associates, 1964.",221.6 H113,4,,  -  -    ,,"Yahweh versus Baal: a conflict of religious cultures; a study in the relevance of Ugaritic materials for the early faith of Israel, by Norman C. Habel.",ONLY PRATT
i10874100,"New York, Random House [1970]",309.1 G672,5,,  -  -    ,3.95,The block. Photos. and text by Herb Goro.,
i1087446x,"London, Arnold [c1960]",669.6082 H453T,0,,  -  -    ,,"Tin and its alloys, by Ernest S. Hedges, with the collaboration of J.W. Cuthbertson [and others]",
i10874562,"New York, The Macmillan company, 1926.",324.2 O96,0,,  -  -    ,,"The presidential primary, by Louise Overacker...",
i10875426,"New York, H. Holt and Company 1893.",150 J23P,0,,  -  -    ,,"...The principles of psychology, by William James ...",
i10875487,"London, Chapman and Hall [1967]",519.92 J17,2,,  -  -    ,,An introduction to dynamic programming; the theory of multistage decision processes [by] O. L. R. Jacobs.,
i10875542,"New York : Brunner/Mazel, 1967-70.",371.96 D611,2,,  -  -    ,,"Disadvantaged child / Jerome Hellmuth, editor.",
i10875554,"New York, The Macmillan Company, 1934.",330.1 L766,,,  -  -    ,,"The method of freedom, by Walter Lippmann.",
i10875578,"New York : United Nations, 1964.",309.22 U58,1,,  -  -    ,,Problems of social development planning : with special reference to Asia and the Far East.,ONLY PRATT
i10876194,"Boston, Little, Brown [1967]",321.5 B124,1,,  -  -    ,,The theory of democratic elitism; a critique.,
i10876236,"New York, Twentieth Century Fund, 1968.",330.95 M998,2,,  -  -    ,,Asian drama; an inquiry into the poverty of nations.,
i10876248,"New York, Twentieth Century Fund, 1968.",330.95 M998,0,,  -  -    ,,Asian drama; an inquiry into the poverty of nations.,
i10876315,"New York, London, The Macmillan Company; 1903.",320.9 M56,0,,  -  -    ,,"A history of American political theories, by C. Edward Merriam.",
i10876339,"New York, F.Ungar Pub. Co. [1962]",425 B915,2,,  -  -    ,,Psychology of English; why we say what we do [by] Margaret M.Bryant and Janet Rankin Aiken.,
i10876819,"Secaucus, N.J. : L. Stuart, c1977.",346.033 R813,6,,  -  -    ,0818402342 : $10.00,Malpractice and other malfeasances / Stanley M. Rosenblatt.,X
i10876868,"New York : Basic Books, c1977.",305.230973 K43,6,1,  -  -    ,0465070434 : $16.50,"Rites of passage : adolescence in America, 1790 to the present / Joseph F. Kett.",X
i10877071,"Berlin ; New York : Springer-Verlag, 1977.",535.58 L649,1,,  -  -    ,387080449,"Nonlinear laser spectroscopy / V. S. Letokhov, V. P. Chebotayev.",
i10877149,"London ; New York : Wiley, c1977.",541.042 M322,2,,  -  -    ,471994480,Introduction to liquid state chemistry / Y. Marcus.,X
i10877241,"New York : AMACOM, c1977.",658.406 M148,1,,  -  -    ,0814453813 : $14.95,Organization development for operating managers / Michael E. McGill.,X
i10877721,"New York, A. S. Barnes & company, 1927.",331.84 N251,7,1,  -  -    ,,"The organization and administration of playgrounds and recreation, by Jay B. Nash...",
i10877745,"Glencoe, Ill., Free Press [1959]",301.451 E26N,1,,  -  -    ,,The Negro professional class. With a foreword by Otis Dudley Duncan.,
i10877873,"New York : Vintage Books, 1977, c1976.",336.7471 F528,3,,  -  -    ,394721934,The Fiscal crisis of American cities : essays on the political economy of urban America with special reference to New York / edited by Roger E. Alcaly and David Mermelstein.,X
i10877939,"New York : Wiley, c1977.",388.4 J77,2,,  -  -    ,470990325,Urban transport appraisal / Ian S. Jones.,ONLY PRATT
i10877940,"Urbana : University of Illinois Press, c1977-1978.",309.17291 L675,0,,  -  -    ,0252006283 (v. 1) : $15.00,"Living the revolution : an oral history of contemporary Cuba / Oscar Lewis, Ruth M. Lewis, Susan M. Rigdon.",X
i10877952,"Urbana : University of Illinois Press, c1977-1978.",309.17291 L675,0,,  -  -    ,0252006283 (v. 1) : $15.00,"Living the revolution : an oral history of contemporary Cuba / Oscar Lewis, Ruth M. Lewis, Susan M. Rigdon.",X
i10877964,"Urbana : University of Illinois Press, c1977-1978.",309.17291 L675,,,  -  -    ,0252006283 (v. 1) : $15.00,"Living the revolution : an oral history of contemporary Cuba / Oscar Lewis, Ruth M. Lewis, Susan M. Rigdon.",X
i10878531,"New York, The Macmillan company, 1923.",370.1 K48,0,,  -  -    ,,"Source book in the philosophy of education, by William Heard Kilpatrick ...",
i10878543,"New York, The Macmillan company, 1923.",370.1 K48,1,,  -  -    ,,"Source book in the philosophy of education, by William Heard Kilpatrick ...",
i10878555,"Bloomington, Indiana University Press 1962.",327.54 C435,25,,  -  -    ,,India's China policy.,X
i10878646,"New York : Wiley, c1977.",616.39 N976,5,,  -  -    ,471023930,Nutritional disorders of American women / edited by Myron Winick.,X
i10878749,"New York : McGraw-Hill, c1977.",658.404 H154,1,,  -  -    ,0070255342 : $15.95,Management of engineering projects / Victor G. Hajek.,X
i10878890,"New York : McGraw-Hill, c1976.",330.973 E23,1,,  -  -    ,0070189676 : $19.50,"Economic growth in the future : the growth debate in national and global perspective / Edison Electric Institute Committee on Economic Growth, Pricing and Energy Use.",X
i1087933x,"New York : Praeger, 1977.",309.151 D492,6,1,  -  -    ,0275564703 : $18.50. 0275896501 pbk. : $5.95,"Deviance and social control in Chinese society / edited by Amy Auerbacher Wilson, Sidney Leonard Greenblatt, Richard Wittingham Wilson.",X
i10879365,"New York : Harcourt Brace Jovanovich, 1977, c1976.",509.2 L869N,4,,  -  -    ,0151472866 : $10.00,Konrad Lorenz / Alec Nisbett.,X
i10879432,"Boston : Houghton Mifflin, 1977.",336.24 C321,3,,  -  -    ,039525177X : $10.00,"The golden egg : the personal income tax--where it came from, how it grew / by Gerald Carson.",X
i10879523,"Baltimore : Johns Hopkins University Press, 1977.",658.4 R888,3,,  -  -    ,801818753,The cultures of management / Robert H. Roy.,X
i10879869,"New York, Knopf, 1967.",327.73 R375B,4,,  -  -    ,,"Beyond Vietnam: the United States and Asia, by Edwin O. Reischauer.",
i10880045,"New York, Dial Press, 1948.",331.88 R659S,1,,  -  -    ,,"Spotlight on a union; the story of the United Hatters, Cap and Millinery Workers International Union.",X
i10880057,"London : published for Sussex University Press by Chatto & Windus, 1976.",537.532 L187,1,,  -  -    ,0844808520 0856210579 pbk,Plasma physics / E. W. Laing.,X
i10880112,"New York, The Century co., 1922.",290 M186,17,,  -  -    ,,"The great secret, by Maurice Maeterlinck, translated by Bernard Miall.",
i10880252,"New York : Harper & Row, c1977.",345.02523 Z58,0,,  -  -    ,0060147911 : $8.95,"Call the final witness : the people v. Darrell R. Mathes, as seen by the eleventh juror / Melvyn Bernard Zerman.",X
i10880276,"New York : Viking Press, 1977.",309.1747 N547,2,,  -  -    ,670102040,"The abuse of power : the permanent Government and the fall of New York / Jack Newfield, Paul Du Brul ; photos. by Janie Eisenberg.",
i10880355,"London, Melbourne [etc.] Macmillan; New York, St. Martin's P., 1967.",146.3 J82,1,,  -  -    ,,The evolution of dialectical materialism: a philosophical and sociological analysis [by] Z. A. Jordan.,
i10880549,New York [1965],543.3 A512,2,,  -  -    ,,"Standard methods for the examination of water and wastewater, including bottom sediments and sludges. Prepared and published jointly by American Public Health Association, American Water Works Association [and] Water Pollution Control Federation.",
i10880707,"New York, Harper & Row [1967]",301.1 H773,5,1,  -  -    ,,Personality in culture [by] John J. Honigmann.,
i10880835,"London : Associated Business Programmes, 1976.",658.054 C738,1,,  -  -    ,0852270496 : L.6.95,Computer applications in management / edited by John R. Birkle and Ronald Yearsley ; foreword by Lord Robens.,ONLY PRATT
i10880872,"New York, Sturgis & Walton company, 1912.",178 P275,3,,  -  -    ,,"Studies in the psychology of intermperance, by G. E. Partridge...",
i10881645,"Hamden, Conn. : Archon Books, 1968.",655 H323M,1,,  -  -    ,,Modern book production / Dorothy Harrop.,
i10881700,"New York : Quadrangle/New York Times Book Co., c1977.",364.138 B658,0,,  -  -    ,812906071,Wanted! : The search for Nazis in America / Howard Blum.,X
i10881712,"New York, The Modern Library [c1936]",331 M996H,5,,  -  -    ,,"History of the great American fortunes, by Gustavus Myers.",
i1088192x,"New York, Hastings House [1959]",153.35 A784C,14,,  -  -    ,,"Creativity, an examination of the creative process; a report on the third communications conference of the Art Directors Club of New York.",
i10882200,"Cambridge, Harvard University Press, 1957-72.",239 A923M,5,,  -  -    ,,The city of God against the pagans.,
i10882212,"Cambridge, Harvard University Press, 1957-72.",239 A923M,3,,  -  -    ,,The city of God against the pagans.,
i10882479,"New York, Harper & Row [1963]",153.3 R929,5,,  -  -    ,,Imagination. With a foreword and editorial comments by Kenneth D. Benne.,
i10882510,"Harrisville, N.H. : Cheshire Books ; Rockville, MD : distributed by RPM Distributors, c1976.",697.78 A545,26,,  -  -    ,0917352017 : $7.50,"The solar home book : heating, cooling, and designing with the sun / by Bruce Anderson with Michael Riordan ; art direction by Linda Goodman, ill. by Edward A. Wong, pencil drawings by Rachel Dutton.",X
i10882819,"Boston : Beacon Press, c1977.",211 O16,2,,  -  -    ,0807011126 : $9.95,Behind the sex of God : toward a new consciousness--transcending matriarchy and patriarchy / Carol Ochs.,X
i10882935,"New York, Basic Books [1972]",370.193 J51,1,,  -  -    ,0465032648 $12.50,Inequality; a reassessment of the effect of family and schooling in America [by] Christopher Jencks [and others],X
i10882947,"New York, Basic Books [1972]",370.193 J51,0,,  -  -    ,0465032648 $12.50,Inequality; a reassessment of the effect of family and schooling in America [by] Christopher Jencks [and others],X
i10882959,"New York, Basic Books [1972]",370.193 J51,4,,  -  -    ,0465032648 $12.50,Inequality; a reassessment of the effect of family and schooling in America [by] Christopher Jencks [and others],X
i10883022,"San Francisco, Jossey-Bass, 1973.",374 H585,0,,  -  -    ,0875892000 $7.75,"Patterns for lifelong learning [by] Theodore M. Hesburgh, Paul A. Miller [and] Clifton R. Wharton, Jr.",
i10883265,"Boston, Little, Brown [c1969]",153.35 G873,2,,  -  -    ,,The right to create.,
