Record Number,Publication Info.,Call No.,Horizon checkouts,Old in-house uses,Checkout Date,Standard No.,Title,CNY
i12823600,"Great Barrington, MA : E.F. Schumacher Society, c2002.",338.927 T634,,,  -  -    ,,Ecological design : reinventing the future / presented by John Todd.,ONLY PRATT
i12823624,"Great Barrington, Mass. : E.F. Schumacher Society, c2005.",303.372 W637,,,  -  -    ,,"Good morning, beautiful business / presented by Judy Wicks.",
i12824665,"Great Barrington, MA : E.F. Schumacher Society, c2005.",327.172092 S972,,,  -  -    ,,"Bob Swann's ""Positively dazzling realism"" / presented by Stephanie Mills.",ONLY PRATT
i12824677,"Great Barrington, MA : E.F. Schumacher Society, c2005.",363.7 L991,,,  -  -    ,,The ice is melting / presented by Oren Lyons.,
i12824689,"Great Barrington, MA : E.F. Schumacher Society, c2008.",338.927 K49,,,  -  -    ,,Salmon economics : (and other lessons) / presented by Andrew Kimbrell.,ONLY PRATT
i12824690,"Great Barrington, MA : Schumacher Center for a New Economics, 2013, c2004.",333.72 B534,,,  -  -    ,,Every being has rights / by Thomas Berry.,ONLY PRATT
i12824719,"Great Barrington, MA : E.F. Schumacher Society, c2007.",338.9 S562,,,  -  -    ,,Going local : new opportunities for community economies / presented by Michael H. Shuman ; edited by Hildegarde Hannum.,ONLY PRATT
i12825931,"Great Barrington, MA : Schumacher Center for a New Economics, [2014]",330.122 B261,,,  -  -    ,,Economics for the Anthropocene / presented by Peter Barnes.,ONLY PRATT
i12827745,"Deer Isle, ME : Haystack Mountain School of Crafts, 2015.;©2015",153.35 P164,,,  -  -    ,,Seeking a needle in the Haystack / by Juhani Pallasmaa.,ONLY PRATT
i12827782,"Amherst, New York : Prometheus Books, 2013.",539.72 L473,,,  -  -    ,9781616148010 (hardback);1616148012 (hardback);9781616148027 (ebook),"Beyond the god particle / Leon M. Lederman, Christopher T. Hill.",X
i12827988,"Great Barrington, MA : E.F. Schumacher Society, c2000",333.2 G558,,,  -  -    ,,A Map : (from the old Connecticut path to the Rio Grande Valley and the the meaning inbetween) / Chellis Glendinning.,ONLY PRATT
i1282799x,"Great Barrington, MA : E.F. Schumacher Society, c2003.",628 L991,,,  -  -    ,,Greening the campus from a purchasing perspective / presented by Kevin Lyons.,ONLY PRATT
i12828002,"Great Barrington, Mass. : E. F. Schumacher Society, c2001.",333.3 C578,,,  -  -    ,,Stories from an Appalachian community / presented by Marie Cirillo ; [edited by Hildegarde Hannum; introduction by Susan Witt].,ONLY PRATT
i12828014,"Great Barrington, MA : E.F. Schumacher Society, 2005, c2002.",303.483 K49,,,  -  -    ,,Cold evil : technology and modern ethics / presented by Andrew Kimbrell.,ONLY PRATT
i12828026,"Great Barrington, MA : E.F. Schumacher Society, c2001.",338.973 K85,,,  -  -    ,,Creating a post-corporate world / presented by David C. Korten.,ONLY PRATT
i12828038,"Great Barrington, MA : E.F. Schumacher Society, 1999.",338.926 E47,,,  -  -    ,,Flapping butterfly wings : a retrospect of TRANET's first twenty years / William Ellis.,ONLY PRATT
i1282804x,"Great Barrington, MA : E.F. Schumacher Society, 2007, c2002.",333.73 H338,,,  -  -    ,,"Democracy, earth rights, and the next economy / presented by Alanna Hartzok.",ONLY PRATT
i12828063,"Great Barrington, MA : E.F. Schumacher Society, c2003.",338.973 L911,,,  -  -    ,,Natural capitalism : the next industrial revolution / presented by Amory Lovins.,ONLY PRATT
i12828440,"New York : Scholastic, c1992.",305.567 T874M,,,  -  -    ,0590446908;9780590446907;0590446916;9780590446914,Sojourner Truth : ain't I a woman? / by Patricia C. McKissack and Fredrick McKissack.,X
i12830641,"Great Barrington, MA : E.F. Schumacher Society, ©1999.",307 M875,,,  -  -    ,,Reclaiming community / presented by David Morris.,
i12833514,"New York, N.Y. : Furman Center for Real Estate and Urban Policy, New York University, 2001-",363.509747 D186,,,  -  -    ,,State of New York City's housing & neighborhoods.,ONLY PRATT
i1283368x,"Cambridge, MA : The MIT Press, [2014]",001 T355,,,  -  -    ,9780262527415 (pbk. : alk. paper);0262527413 (pbk. : alk. paper);40024661954,"Textures of the anthropocene : grain, vapor, ray / edited by Katrin Klingan, Ashkan Sepahvand, Christoph Rosol, and Bernd M. Scherer.",X
i12833691,"Cambridge, MA : The MIT Press, [2014]",001 T355,,,  -  -    ,9780262527415 (pbk. : alk. paper);0262527413 (pbk. : alk. paper);40024661954,"Textures of the anthropocene : grain, vapor, ray / edited by Katrin Klingan, Ashkan Sepahvand, Christoph Rosol, and Bernd M. Scherer.",X
i1283371x,"Cambridge, MA : The MIT Press, [2014]",001 T355,,,  -  -    ,9780262527415 (pbk. : alk. paper);0262527413 (pbk. : alk. paper);40024661954,"Textures of the anthropocene : grain, vapor, ray / edited by Katrin Klingan, Ashkan Sepahvand, Christoph Rosol, and Bernd M. Scherer.",X
i12834580,"Detroit : Wayne State University Press, [2014]",070.18 D6371,,,03-06-2018 13:54:31.0,9780814339718 (pbk.);0814339719 (pbk.);9780814339725 (ebook);0814339727 (ebook),Documenting the documentary : close readings of documentary film and video / with a foreword by Bill Nichols ; edited by Barry Keith Grant and Jeannette Sloniowski.,
i12835663,"Cambridge, Mass. : Belknap Press of Harvard University Press, [2012]",639.2 B693,,,  -  -    ,9780674047655;0674047656,The mortal sea : fishing the Atlantic in the Age of Sail / W. Jeffrey Bolster.,
i12835675,"New York : Metropolitan Books/Henry Holt and Company, 2014.",306.362098 G753,,,  -  -    ,9780805094534 (hardcover);0805094539 (hardcover);9781429943178 (electronic book),"The Empire of Necessity : Slavery, Freedom, and Deception in the New World / Greg Grandin.",
i12837118,"Great Barrington, MA : E.F. Schumacher Society, c2000.",306.20973 S299,,,  -  -    ,,The Friendship club and the well-springs of civil society / presented by William Schambra.,ONLY PRATT
i12837180,"Princeton, N.J. : Princeton University Press, 2011, c2009.",355.7 V782,,,  -  -    ,9780691149837 (pbk.);0691149836 (pbk.),Island of shame : the secret history of the U.S. military base on Diego Garcia / David Vine ; with a new afterword by the author.,ONLY PRATT
i12837192,"Berkeley : University of California Press, ©1997.",304.2 L675,,,  -  -    ,0520207424 (alk. paper);9780520207424 (alk. paper);0520207432 (pbk. : alk. paper);9780520207431 (pbk. : alk. paper),"The myth of continents : a critique of metageography / Martin W. Lewis, Kären E. Wigen.",
i12837829,"New York : Free Press, 1965.",136.74 P579M,,,  -  -    ,0317305913;9780317305913;0029252407 (pbk.);9780029252406 (pbk.),The moral judgment of the child / Jean Piaget ; with the assistance of seven collaborators ; translated by Marjorie Gabain.,X
i12837921,"Princeton, N.J. : Princeton University Press, [1970]","131 J95C2, v.14",,,  -  -    ,691097666,Mysterium coniunctionis : an inquiry into the separation and synthesis of psychic opposites in alchemy / C. G. Jung ; translated by R. F. C. Hull.,
i12838238,"Zurich : JRP/Ringier, [2014];©2014",070.50949 J115B,,,  -  -    ,9783037644133 (paperback);3037644133 (paperback),10 years in art publishing : an A-Z memoir / Lionel Bovier ; [editing and proofreading Clare Manchester].,ONLY PRATT
i12838305,"Lanham : Rowman & Littlefield, [2015];©2015",306.362082 W517,,,  -  -    ,9781442208711 (hbk. : alkaline paper);1442208716 (hbk. : alkaline paper);9781442208735 (electronic);1442208732 (electronic);9781442208735 (electronic),Enslaved women in America : from colonial times to Emancipation / Emily West.,X
i12838421,"Great Barrington, Mass. : New Economics Institute, c2011.",333.642 S562,,,  -  -    ,,Local stock exchanges : the next wave of community economy building / presented by Michael Shuman.,ONLY PRATT
i12838433,"Great Barrington, MA : E.F. Schumacher Society, c2009.",333.7 M158,,,  -  -    ,,The most important number in the world / presented by Bill McKibben.,ONLY PRATT
i12838445,"Great Barrington, MA : E.F. Schumacher Society, c2006.",338.19 H468,,,  -  -    ,,Fifty million farmers / presented by Richard Heinberg.,ONLY PRATT
i12838457,"Great Barrington, MA : New Economics Institute, c2012.",330.16 S374,,,  -  -    ,,The new economics of plenitude / presented by Juliet B. Schor ; [introduction by Jessica Brachman].,ONLY PRATT
i12838469,"Great Barrington, MA : E.F. Schumacher Society, c2008.",636.0883 B234,,,  -  -    ,,Natural foie gras and the future of food / presented by Dan Barber.,ONLY PRATT
i12838470,"Great Barrington, Mass. : E.F. Schumacher Society, 2007.",338.92 T945,,,  -  -    ,,What about us--: the earth's people? / presented by Charles Turner.,ONLY PRATT
i12838482,"Great Barrington, MA : New Economics Institute, c2011.",337.1 W214,,,  -  -    ,,Voices of a new economics / presented by Stewart Wallis ; [introduction by Susan Witt].,ONLY PRATT
i12838494,"Great Barrington, MA : New Economics Institute, c2011.",333.7313 A456,,,  -  -    ,,The possiblity of profound change in America / presented by Gar Alperovitz ; edited by Hildegarde Hannum.,ONLY PRATT
i12838500,"Great Barrington, MA : New Economics Institute, c2012.",330.122 A456,,,  -  -    ,,"If you don't like capitalism or state socialism, what do you want? / presented by Gar Alperovitz ; edited by Hildegarde Hannum.",ONLY PRATT
i12838512,"Great Barrington, MA : New Economics Institute, c2011.",320.1 S752,,,  -  -    ,,"Letter to liberals : liberalism, environmentalism, and economic growth / presented by James Gustave Speth ; [introduction by Will Raap].",ONLY PRATT
i12838779,"[Brooklyn, N.Y.] : Pratt Institute Fashion Design Department, [2011]",391.097471 P917PRATT,,,  -  -    ,,2011 Pratt fashion show : honoring Hamish Bowles.,ONLY PRATT
i12838780,"[Brooklyn, NY] : Pratt, [2012]",391.097471 P917F,,,  -  -    ,,Fashion collective 2012.,ONLY PRATT
i12839875,"Great Barrington, MA : E.F. Schumacher Society, 2005.",304.2 T633,,,  -  -    ,,An ecological economic order / presented by John Todd.,ONLY PRATT
i12839887,"Great Barrington, MA. : E.F. Schumacher society, 1989.",338.9 H496,,,  -  -    ,,Development beyond economism : local paths to sustainable development / presented by Hazel Henderson.,ONLY PRATT
i12839899,"Great Barrington, MA : E.F. Schumacher society, 1990.",321.06 K79,,,  -  -    ,,Why small is beautiful : the size interpretation of history / presented by Leopold Kohr.,ONLY PRATT
i12839917,"Great Barrington, MA : E.F. Schumacher Society, 1984.",179.1 S768,,,  -  -    ,,Green politics : the spiritual dimension / presented by Charlene Spretnak.,ONLY PRATT
i12839929,"Great Barrington, MA : E.F. Schumacher Society, 1984.",303.4 M159,,,  -  -    ,,John Deere and the bereavement counselor / presented by John L. McKnight.,ONLY PRATT
i12839930,"Great Barrington, MA : E.F. Schumacher Society, c1999.",304.2 S163,,,  -  -    ,,Mother of all : an introduction to bioregionalism / presented by Kirkpatrick Sale.,ONLY PRATT
i12839942,"[Great Barrington, MA] : [E.F. Schumacher Society], [1982]",338.927 M174,,,  -  -    ,,The community's role in appropriate technology / presented by George McRobie.,ONLY PRATT
i12839954,"Great Barrington, MA : E.F. Schumacher Society, 1981.",577.55 J14,,,  -  -    ,,Call for a revolution in agriculture / presented by Wes Jackson.,ONLY PRATT
i12839966,"[Great Barrington, MA] : [E.F. Schumacher Society], [1982]",362.82 B763,,,  -  -    ,,The family as a small society / presented by Elise Boulding.,ONLY PRATT
i12842151,"Minneapolis : University of Minnesota Press, [2014]",306.484 H282,,,  -  -    ,9780816692293 (pb : alk. paper);0816692297 (pb : alk. paper);9780816692286 (hc : alk. paper);0816692289 (hc : alk. paper),"Chicago hustle and flow : gangs, gangsta rap, and social class / Geoff Harkness.",X
i12842163,"Lanham, Maryland : Bernan Press, [2015]",344.730463 C623,,,  -  -    ,9781598886474 pbk.;1598886479 pbk.;9781598886481 electronic bk.;1598886487 electronic bk.,"Clean air handbook / Hunton & Williams ; principal author and editor, F. William Brownell ; contributing authors, Radoslawa Boczkaj-Gonzalez [and 11 others].",X
